{
  "$schema": "https://gcn.nasa.gov/schema/v7.2.3/gcn/notices/core/Localization.schema.json",
  "ra": 120,
  "dec": 45,
  "ra_dec_error": [0.5, 0.8, 0],
  "containment_probability": 0.95,
  "systematic_included": true,
  "instrument_phi": 90,
  "instrument_theta": 45,
  "instrument_semimajor_angle": 50,
  "healpix_url": "http://example.com/localization.fits",
  "healpix_file": "H4sIAAAAAAAAC......."
}
